{
  "$schema": "./register.schema.json",
  "schemaVersion": 1,
  "policy": {
    "admissionStatus": "tier-0-recorded-release-admission-pending",
    "reason": "Every direct row explicitly records exact-artifact licence evidence, maintenance status, point-in-time security evidence/history limitation, native/binary implications, measured local installed footprint evidence, exposure, and a removal boundary. Full release admission remains pending where the row says a live upstream, legal-obligation, historical advisory, platform, or runtime/bundle review is not yet established.",
    "currentAuditEvidence": [
      "evidence/dependencies/npm-audit-production.json",
      "evidence/dependencies/npm-audit-full.json"
    ],
    "metadataEvidence": "evidence/dependencies/dependency-metadata.json"
  },
  "nativeTools": [
    {
      "name": "Node.js",
      "expectedVersion": "24.18.0",
      "role": "Pinned production runtime and repository toolchain",
      "commands": ["node"],
      "admissionStatus": "tier-0-recorded-release-admission-pending",
      "review": {
        "license": {
          "status": "local-binary-or-cli-identity-recorded-distribution-obligations-pending",
          "evidence": "evidence/dependencies/dependency-metadata.json nativeTools command hashes, paths, and runtime artifact metadata"
        },
        "maintenance": {
          "status": "undetermined-live-upstream-review-pending",
          "timeSensitive": true,
          "evidence": "The exact local/provisioned version and source input digest are recorded; live upstream cadence, support, and EOL status remain undetermined."
        },
        "securityHistory": {
          "status": "not-covered-by-npm-audit-native-advisory-review-pending",
          "timeSensitive": true,
          "evidence": "evidence/dependencies/dependency-metadata.json exact native version/path/SHA-256; a native upstream advisory source was not queried by this local-artifact slice"
        },
        "scriptsAndNative": {
          "status": "exact-command-version-path-sha256-and-dynamic-linkage-recorded",
          "evidence": "evidence/dependencies/dependency-metadata.json nativeTools"
        },
        "cost": {
          "status": "installed-artifact-and-command-bytes-files-recorded-runtime-resource-cost-unmeasured",
          "evidence": "evidence/dependencies/dependency-metadata.json nativeTools artifactEvidence footprint and commands[].bytes",
          "measured": "Installed artifact/prefix bytes and file counts plus every required command byte size on the evidence platform."
        }
      },
      "removalBoundary": "Replace the runtime wrapper, engines/package-manager contract, CI image, and every deployable artifact together, then re-run all gates.",
      "provenance": {
        "kind": "node-runtime-archive",
        "input": "tooling/pinned-runtime.mjs",
        "downloadHelper": "tooling/bounded-download.mjs",
        "source": "https://nodejs.org/dist/v24.18.0/",
        "verification": "Bootstrap enforces the selected platform archive Content-Length ceiling and SHA-256 before extraction.",
        "artifacts": {
          "darwin-arm64": {
            "archive": "node-v24.18.0-darwin-arm64.tar.gz",
            "sha256": "e1a97e14c99c803e96c7339403282ea05a499c32f8d83defe9ef5ec66f979ed1"
          },
          "darwin-x64": {
            "archive": "node-v24.18.0-darwin-x64.tar.gz",
            "sha256": "dfd0dbd3e721503434df7b7205e719f61b3a3a31b2bcf9729b8b91fea240f080"
          },
          "linux-arm64": {
            "archive": "node-v24.18.0-linux-arm64.tar.xz",
            "sha256": "58c9520501f6ae2b52d5b210444e24b9d0c029a58c5011b797bc1fe7105886f6"
          },
          "linux-x64": {
            "archive": "node-v24.18.0-linux-x64.tar.xz",
            "sha256": "55aa7153f9d88f28d765fcdad5ae6945b5c0f98a36881703817e4c450fa76742"
          }
        }
      }
    },
    {
      "name": "npm CLI",
      "expectedVersion": "11.16.0",
      "role": "Pinned workspace resolver, lifecycle-policy boundary, auditor, and task runner",
      "commands": ["npm"],
      "admissionStatus": "tier-0-recorded-release-admission-pending",
      "review": {
        "license": {
          "status": "local-binary-or-cli-identity-recorded-distribution-obligations-pending",
          "evidence": "evidence/dependencies/dependency-metadata.json nativeTools command hashes, paths, and runtime artifact metadata"
        },
        "maintenance": {
          "status": "undetermined-live-upstream-review-pending",
          "timeSensitive": true,
          "evidence": "The exact local/provisioned version and source input digest are recorded; live upstream cadence, support, and EOL status remain undetermined."
        },
        "securityHistory": {
          "status": "npm-current-advisory-snapshot-recorded-historical-status-undetermined",
          "timeSensitive": true,
          "evidence": "evidence/dependencies/npm-audit-full.json"
        },
        "scriptsAndNative": {
          "status": "exact-command-version-path-sha256-and-dynamic-linkage-recorded",
          "evidence": "evidence/dependencies/dependency-metadata.json nativeTools"
        },
        "cost": {
          "status": "installed-artifact-and-command-bytes-files-recorded-runtime-resource-cost-unmeasured",
          "evidence": "evidence/dependencies/dependency-metadata.json nativeTools artifactEvidence footprint and commands[].bytes",
          "measured": "Installed artifact/prefix bytes and file counts plus every required command byte size on the evidence platform."
        }
      },
      "removalBoundary": "Replace package-manager and lockfile semantics plus bootstrap/task/CI commands atomically, then regenerate dependency evidence.",
      "provenance": {
        "kind": "bundled-cli",
        "input": "tooling/pinned-runtime.mjs",
        "source": "Bundled inside the checksum-verified Node.js 24.18.0 distribution",
        "verification": "The wrapper executes the npm CLI through the pinned Node binary and verifies exact npm 11.16.0."
      }
    },
    {
      "name": "PostgreSQL native distribution",
      "expectedVersion": "16.14",
      "role": "Authoritative local and integration ledger datastore",
      "commands": ["postgres", "pg_ctl", "initdb", "psql", "pg_isready", "createdb"],
      "admissionStatus": "tier-0-recorded-release-admission-pending",
      "review": {
        "license": {
          "status": "local-binary-or-cli-identity-recorded-distribution-obligations-pending",
          "evidence": "evidence/dependencies/dependency-metadata.json nativeTools command hashes, paths, and runtime artifact metadata"
        },
        "maintenance": {
          "status": "undetermined-live-upstream-review-pending",
          "timeSensitive": true,
          "evidence": "The exact local/provisioned version and source input digest are recorded; live upstream cadence, support, and EOL status remain undetermined."
        },
        "securityHistory": {
          "status": "not-covered-by-npm-audit-native-advisory-review-pending",
          "timeSensitive": true,
          "evidence": "evidence/dependencies/dependency-metadata.json exact native version/path/SHA-256; a native upstream advisory source was not queried by this local-artifact slice"
        },
        "scriptsAndNative": {
          "status": "exact-command-version-path-sha256-and-dynamic-linkage-recorded",
          "evidence": "evidence/dependencies/dependency-metadata.json nativeTools"
        },
        "cost": {
          "status": "installed-artifact-and-command-bytes-files-recorded-runtime-resource-cost-unmeasured",
          "evidence": "evidence/dependencies/dependency-metadata.json nativeTools artifactEvidence footprint and commands[].bytes",
          "measured": "Installed artifact/prefix bytes and file counts plus every required command byte size on the evidence platform."
        }
      },
      "removalBoundary": "Replace only through a ledger datastore ADR, schema/data migration and rollback, backup/restore proof, and full invariant/concurrency re-proof.",
      "provenance": {
        "kind": "source-built-native",
        "input": "tooling/ci/provision-native.mjs",
        "downloadHelper": "tooling/bounded-download.mjs",
        "source": "https://ftp.postgresql.org/pub/source/v16.14/postgresql-16.14.tar.bz2",
        "sourceSha256": "f6d077142737920858ce958ccdb75c6ee137a63b5b0853c70693d401ac7e3471",
        "buildFlags": ["--without-icu", "--without-readline", "--without-zlib", "make -j2"],
        "verification": "Provisioner bounds Content-Length, verifies SHA-256 before extraction, builds inside repository cache, then probes exact binary versions."
      }
    },
    {
      "name": "Redis native distribution",
      "expectedVersion": "8.10.0",
      "role": "Local and integration cache and coordination service, never monetary authority",
      "commands": ["redis-server", "redis-cli"],
      "admissionStatus": "tier-0-recorded-release-admission-pending",
      "review": {
        "license": {
          "status": "local-binary-or-cli-identity-recorded-distribution-obligations-pending",
          "evidence": "evidence/dependencies/dependency-metadata.json nativeTools command hashes, paths, and runtime artifact metadata"
        },
        "maintenance": {
          "status": "official-8.10.0-ga-observed-live-support-and-eol-review-pending",
          "timeSensitive": true,
          "evidence": [
            "https://github.com/redis/redis/releases/tag/8.10.0",
            "evidence/dependencies/dependency-metadata.json exact local/provisioned version, command identities, and source input digest"
          ],
          "limitation": "The official 8.10.0 General Availability release was observed, but live release cadence, support window, and EOL status remain undetermined."
        },
        "securityHistory": {